{
  "$schema": "https://json-schema.org/draft-07/schema#",
  "$id": "https://playidea-lab.github.io/pcq/spec/schemas/pcq.run.envelope.schema.json",
  "title": "pcq.run.envelope",
  "description": "pcq run --json envelope for executed or config-only runs",
  "type": "object",
  "additionalProperties": true,
  "required": [
    "cmd",
    "project_root",
    "runtime_cfg_path",
    "schema_version",
    "status"
  ],
  "properties": {
    "attribution": {
      "type": "object"
    },
    "cmd": {
      "type": "string"
    },
    "contract_version": {
      "type": [
        "string",
        "null"
      ]
    },
    "error": {
      "type": "string"
    },
    "exit_code": {
      "type": "integer"
    },
    "fingerprint": {
      "type": [
        "object",
        "null"
      ],
      "additionalProperties": false,
      "properties": {
        "schema_version": {
          "type": "integer",
          "const": 1
        },
        "modality": {
          "type": "string",
          "enum": [
            "tabular",
            "image",
            "text",
            "time_series",
            "audio",
            "graph",
            "other"
          ]
        },
        "task_kind": {
          "type": "string",
          "enum": [
            "classification",
            "regression",
            "segmentation",
            "detection",
            "seq2seq",
            "generation",
            "forecasting",
            "anomaly_detection",
            "clustering",
            "other"
          ]
        },
        "n_samples": {
          "type": [
            "integer",
            "null"
          ]
        },
        "size_class": {
          "type": "string",
          "enum": [
            "small",
            "medium",
            "large",
            "huge"
          ]
        },
        "tabular": {
          "type": [
            "object",
            "null"
          ],
          "additionalProperties": false,
          "properties": {
            "n_columns": {
              "type": [
                "integer",
                "null"
              ]
            },
            "type_counts": {
              "type": [
                "object",
                "null"
              ],
              "additionalProperties": false,
              "properties": {
                "numeric": {
                  "type": [
                    "integer",
                    "null"
                  ]
                },
                "categorical": {
                  "type": [
                    "integer",
                    "null"
                  ]
                },
                "datetime": {
                  "type": [
                    "integer",
                    "null"
                  ]
                },
                "text": {
                  "type": [
                    "integer",
                    "null"
                  ]
                }
              }
            },
            "target_balance": {
              "type": [
                "number",
                "null"
              ]
            },
            "n_classes": {
              "type": [
                "integer",
                "null"
              ]
            },
            "missing_ratio_max": {
              "type": [
                "number",
                "null"
              ]
            },
            "sampled_rows": {
              "type": [
                "integer",
                "null"
              ]
            }
          }
        },
        "image": {
          "type": [
            "object",
            "null"
          ],
          "additionalProperties": false,
          "properties": {
            "input_shape": {
              "type": [
                "array",
                "null"
              ],
              "items": {
                "type": "integer"
              }
            },
            "n_classes": {
              "type": [
                "integer",
                "null"
              ]
            }
          }
        },
        "text": {
          "type": [
            "object",
            "null"
          ],
          "additionalProperties": false,
          "properties": {
            "avg_token_len": {
              "type": [
                "number",
                "null"
              ]
            },
            "vocab_kind": {
              "type": [
                "string",
                "null"
              ],
              "enum": [
                "english",
                "korean",
                "multilingual",
                "code",
                "other",
                null
              ]
            }
          }
        },
        "time_series": {
          "type": [
            "object",
            "null"
          ],
          "additionalProperties": false,
          "properties": {
            "seq_len": {
              "type": [
                "integer",
                "null"
              ]
            },
            "freq": {
              "type": [
                "string",
                "null"
              ]
            }
          }
        },
        "audio": {
          "type": [
            "object",
            "null"
          ],
          "additionalProperties": false,
          "properties": {
            "sample_rate": {
              "type": [
                "integer",
                "null"
              ]
            },
            "avg_duration_sec": {
              "type": [
                "number",
                "null"
              ]
            }
          }
        },
        "graph": {
          "type": [
            "object",
            "null"
          ],
          "additionalProperties": false,
          "properties": {
            "n_nodes": {
              "type": [
                "integer",
                "null"
              ]
            },
            "n_edges": {
              "type": [
                "integer",
                "null"
              ]
            },
            "n_node_features": {
              "type": [
                "integer",
                "null"
              ]
            }
          }
        },
        "other": {
          "type": [
            "object",
            "null"
          ],
          "additionalProperties": true,
          "properties": {
            "hint": {
              "type": [
                "string",
                "null"
              ]
            },
            "payload": {
              "type": [
                "object",
                "null"
              ],
              "additionalProperties": true
            }
          }
        },
        "domain": {
          "type": "string",
          "enum": [
            "general",
            "medical",
            "financial",
            "regulated",
            "other"
          ]
        },
        "source": {
          "type": "string",
          "enum": [
            "detected",
            "detected_sampled",
            "declared",
            "merged"
          ]
        }
      },
      "required": [
        "schema_version",
        "modality",
        "task_kind",
        "domain",
        "source"
      ]
    },
    "integrity": {
      "type": [
        "object",
        "null"
      ],
      "additionalProperties": false,
      "properties": {
        "content_hash": {
          "type": "string"
        },
        "hashed_fields": {
          "type": "array",
          "items": {
            "type": "string"
          }
        }
      },
      "required": [
        "content_hash",
        "hashed_fields"
      ]
    },
    "intent": {
      "type": [
        "object",
        "null"
      ],
      "additionalProperties": false,
      "properties": {
        "goal": {
          "type": "string",
          "enum": [
            "baseline_reproduction",
            "sota_challenge",
            "ablation",
            "hyperparam_sweep",
            "exploration"
          ]
        },
        "expected_baseline": {
          "type": [
            "object",
            "null"
          ],
          "additionalProperties": false,
          "properties": {
            "metric": {
              "type": "string"
            },
            "value": {
              "type": "number"
            }
          }
        },
        "tolerance": {
          "type": [
            "object",
            "null"
          ],
          "additionalProperties": false,
          "properties": {
            "direction": {
              "type": "string",
              "enum": [
                "higher_is_better",
                "lower_is_better"
              ]
            },
            "margin": {
              "type": "number"
            }
          }
        }
      },
      "required": [
        "goal"
      ]
    },
    "project_root": {
      "type": "string"
    },
    "runtime_cfg_path": {
      "type": "string"
    },
    "schema_version": {
      "type": "integer"
    },
    "status": {
      "type": "string",
      "enum": [
        "completed",
        "failed",
        "config_only",
        "error"
      ]
    },
    "stderr_path": {
      "type": "string"
    },
    "stderr_tail": {
      "type": "string"
    },
    "stderr_tail_truncated": {
      "type": "boolean"
    },
    "stdout_path": {
      "type": "string"
    },
    "stdout_tail": {
      "type": "string"
    },
    "stdout_tail_truncated": {
      "type": "boolean"
    },
    "worker_spec": {
      "type": [
        "object",
        "null"
      ],
      "additionalProperties": false,
      "properties": {
        "schema_version": {
          "type": "integer",
          "const": 1
        },
        "cpu": {
          "type": [
            "object",
            "null"
          ],
          "additionalProperties": false,
          "properties": {
            "model": {
              "type": [
                "string",
                "null"
              ]
            },
            "cores_physical": {
              "type": [
                "integer",
                "null"
              ]
            },
            "cores_logical": {
              "type": [
                "integer",
                "null"
              ]
            },
            "max_freq_mhz": {
              "type": [
                "integer",
                "null"
              ]
            }
          }
        },
        "memory": {
          "type": [
            "object",
            "null"
          ],
          "additionalProperties": false,
          "properties": {
            "total_gb": {
              "type": [
                "number",
                "null"
              ]
            }
          }
        },
        "accelerator": {
          "type": "object",
          "additionalProperties": false,
          "properties": {
            "kind": {
              "type": "string",
              "enum": [
                "mps",
                "cuda",
                "cpu"
              ]
            },
            "gpus": {
              "type": "array",
              "items": {
                "type": "object",
                "additionalProperties": false,
                "properties": {
                  "model": {
                    "type": "string"
                  },
                  "vram_gb": {
                    "type": [
                      "number",
                      "null"
                    ]
                  },
                  "cuda_version": {
                    "type": [
                      "string",
                      "null"
                    ]
                  },
                  "torch_ordinal": {
                    "type": [
                      "integer",
                      "null"
                    ]
                  }
                },
                "required": [
                  "model"
                ]
              }
            },
            "visible_devices": {
              "type": [
                "string",
                "null"
              ]
            }
          },
          "required": [
            "kind",
            "gpus"
          ]
        },
        "os": {
          "type": [
            "object",
            "null"
          ],
          "additionalProperties": false,
          "properties": {
            "system": {
              "type": "string"
            },
            "machine": {
              "type": "string"
            },
            "release": {
              "type": [
                "string",
                "null"
              ]
            }
          }
        },
        "container": {
          "type": "object",
          "additionalProperties": false,
          "properties": {
            "kind": {
              "type": "string",
              "enum": [
                "none",
                "docker",
                "k8s",
                "other"
              ]
            },
            "image": {
              "type": [
                "string",
                "null"
              ]
            },
            "detector_hint": {
              "type": [
                "string",
                "null"
              ]
            }
          },
          "required": [
            "kind"
          ]
        },
        "source": {
          "type": "string",
          "enum": [
            "detected",
            "declared",
            "merged"
          ]
        }
      },
      "required": [
        "schema_version",
        "accelerator",
        "container",
        "source"
      ]
    }
  },
  "x-pcq-schema-version": 1,
  "x-pcq-additive-only": true
}
