{
  "schema_version": 1,
  "cmd": "uv run python train.py",
  "runtime_cfg_path": "...",
  "project_root": "...",
  "status": "completed",
  "exit_code": 0,
  "stdout_path": "...",
  "stderr_path": "...",
  "stdout_tail": "@epoch=0 @eval_acc=1\n",
  "stdout_tail_truncated": false,
  "stderr_tail_truncated": false
}
